{
  "$schema": "../../docs.config.schema.json",
  "version": 1,
  "name": "Acme Docs",
  "description": "How to install and run Acme.",
  "logo": "assets/logo.svg",
  "github": "https://github.com/acme/acme",
  "navigation": [
    { "label": "Introduction", "href": "/" },
    {
      "label": "Guides",
      "items": [{ "label": "Setup", "href": "/guides/setup" }]
    }
  ]
}
